post_number,date,type,caption,caption_length,likes,comments,video_views,engagement,url
35,2026-02-25 19:39:28,Sidecar,"“Rise from the ashes of your struggles - stronger, brighter, and unbreakable”

Cardiophylax (“heart protector”) original inspiration taken from the chest plate on gladiator.

Swipe through for the full breakdown.

Took an idea to @dannybirch.tattoo he turned it into a dream vision, and I couldn’t be any happier with it.

7 hours of incredible chat about life and business to top it off as well, amazing experience all around.

Oh and no I don’t care about your opinion of tattoos 😊",483,182,39,0,221,https://www.instagram.com/p/DVMWRVZjiG1/
36,2026-02-24 18:05:56,Video,"This is why you aren’t generating leads, better responses in DMs and more interactions

Nobody knows anything about you

All you are doing it trying to sell at them

People have had this for a decade now

LEAD WITH YOU

Inside my program, I call this arrow heading your personal brand

(Not the AI penis)

It’s how you can present yourself as the conquerer of an experience

(Never the victim)

While merging pain and your offer into the equation

This can also easily be done IP merging pain from sales call transcript, human knowledge IP and your offer IP easily enough

Give it a go 🎯

Happy shafting 😂",605,76,14,1183,90,https://www.instagram.com/p/DVJmsjHCB7z/
37,2026-03-02 08:39:11,Image,Genuinely interested…?,22,40,67,0,107,https://www.instagram.com/p/DVYCpUqCE6i/
38,2026-03-04 18:07:50,Video,"You are NOT behind (yet!)

85% population have never used it.

16% population using free chatbot.

0.3% paying AI subscriptions.

0.04% using AI at high level coding.

Red will destroy yellow.

Yellow will destroy green.

Green will destroy grey.

It’s down to you to see where you want to sit.

I would bet every single penny I have on the landscape of businesses being completely re-shaped in the next 6 months for positive and negative reasons.

You won’t be replaced by AI.

You will be replaced by people using it.",519,185,13,21750,198,https://www.instagram.com/p/DVeNQhECNE0/
39,2026-03-01 18:26:18,Sidecar,"The next level for @thecoachconsultant | @benhawksworth_ | @walktalkmensclub requires something different 

Slides have a full comprehensive breakdown of this test and decision 👍🏻",179,86,3,0,89,https://www.instagram.com/p/DVWhE9IiFiY/
40,2026-02-26 09:22:56,Video,"Do you genuinely still think AI is a choice?

While you are sat there debating whether to use it or not

Someone in your niche and market has built out entire new products, systems and x10 better positioning without the guess work

For the amount of time that I am taking to write this caption right now, someone could have generated 3 months worth of hyper targeted content

Businesses that will win from this point forwards are the ones that learn faster, fail faster and launch faster

Anyone waiting for the perfect time to start, will get left behind - there is no longer a middle ground with this

Your personal brand positioning is the ONLY thing that will separate you online in 2026 to fight against it

Your rate of processing and adoption to AI is the ONLY thing that will enable you to keep up 

AI WILL NOT REPLACE PEOPLE

It will replace people who aren’t using it to it’s maximum potential",904,188,16,31757,204,https://www.instagram.com/p/DVN0b23CCFn/
41,2026-02-27 16:45:13,Video,"Most people overlook the pot washer

That’s a mistake

In a restaurant, they’re the backbone

Without clean pots, nothing gets plated

Without plates, no food goes out

Without food going out, the whole place stops

A good pot washer has a system

Everything racked, stacked, timed to perfection

They know what the chefs need before they ask

That’s not a low skill job

That’s the engine room of the kitchen

Nothing should ever be beneath you

You do what needs doing, and you do it well

Pride isn’t about the title

It’s about the standard you hold yourself to

Watch the full post to hear more on this",607,42,1,1000,43,https://www.instagram.com/p/DVRHECwiNx5/
